{"apply_kind":"local-account-password-lock","check_contract_id":"local-account-password-state-check-semantic-v2","concurrency":{"exclusive_lock":"SYSTEM_ACCOUNT_DB_LOCK","reread_under_lock":true,"stale_prestate":"ABORT_NO_MUTATION"},"contract_class":"APPLY","control_id":"FSTEC-LINUX-2022-2.1.1-LOCAL-ACCOUNT-PASSWORD-STATE","donor_mapping":[{"decision":"ADAPT","mapping_id":"MAP-FUNC-0226","usage":"transaction mechanics only"},{"decision":"REJECT","mapping_id":"MAP-FUNC-0296","usage":"standalone RESTORE excluded"}],"dry_run":{"host_mutation":false,"must_report_exact_target_set":true,"required":true},"forbidden":["user-invokable RESTORE"],"mutation":{"allowed_paths":["/etc/shadow"],"no_generated_secret":true,"preserve_present_security_metadata":true,"preserve_unrelated_bytes":true,"transform_id":"empty-field-to-bang"},"postcondition":{"current_check_required":true,"idempotent_reapply":"NO_MUTATION","required_compliance":"PASS"},"precondition":{"check_error":"ABORT_NO_MUTATION","check_fail":"ELIGIBLE_FOR_APPLY","check_pass":"NOOP_SUCCESS"},"privilege":"ROOT_REQUIRED_FAIL_CLOSED","recovery":{"security_weakening_compensation":"FORBIDDEN","successful_apply":"EXTERNAL_SNAPSHOT","user_restore":false},"semantic_contract_id":"local-account-password-state-apply-semantic-v1","semantic_contract_version":1,"source_row":"SRC-0001","target_id":"linux-x86_64-supported-v1","target_selection":{"exact_set_required":true,"population_authority":"current CHECK semantic v2","predicate_id":"empty-password-field"},"transaction":{"after_mutation_failure":"NO_UNSAFE_COMPENSATION_EXTERNAL_RECOVERY","before_commit_failure":"CLEANUP_TEMP_ONLY","commit_model":"SINGLE_ATOMIC_FILE_COMMIT"}}
